{
  "contract_mismatches": [],
  "design_mismatches": [],
  "implementation_fingerprints": {
    ".claude-plugin/plugin.json": "a34d823c887e0a67f377848c454b6ab34afe7c4494f18dbc05d1ea0c219a5ae7",
    ".codex-plugin/plugin.json": "33b36d1bb0aa4464c822f5c7fa3aa25eecd4b8f6097a250cb31cd4b516f9c214",
    "AGENTS.md": "ec4b49970c20f6aa1480a43f2c4d7697343a404599f64ba0c7bae4e6f0117005",
    "CLAUDE.md": "ec4b49970c20f6aa1480a43f2c4d7697343a404599f64ba0c7bae4e6f0117005",
    "README.md": "ae4a7aed562bfb88ecdacb3136dc0ce4fda7af3300ae3c591c6b8efe5bd18ec6",
    "agents/reviewer.md": "1bdc0c8efca607928d19bfb8c0369f92f9f78edcd493def4d9ee99122e42aeb7",
    "audit/audit-log.md": "5315899db1ebd130e32ab275c66c4ee499fa8d7e0ca6f706b072202e89de3270",
    "dispatcher/artifact-dependencies.json": "6584a0ec5648e91bf63748476c83c5ca1c453125ac6df877eda4ff673058615e",
    "dispatcher/dispatcher.md": "3316bb7fce40ce9d114255b61658705812fb7a734a9989b8e39e5d3cb0de69d6",
    "dispatcher/documentation-convergence.schema.json": "8f551cfb9df56c5e7c9b368dad4b9ed951b711b94e1ac7dd96622e46f3b21e7f",
    "dispatcher/execution-contract.md": "ac6f77b7024e323ebbcbc0a4c344852b93fb778cb6b9075885b984bc346e67ba",
    "dispatcher/feature-manifest.schema.json": "7e9180496bf06a34b9760670c3120ee0344f217eb4ca6fa6549d82d7c39b4f58",
    "dispatcher/feature-review.schema.json": "0959e3172b5c7b55429a52daf9d149f73d4389d11f6623fce2dd74bc68f32ac0",
    "dispatcher/feature-state.schema.json": "82a8ad6fc31ac0c475e92ca6848311f1350ba97687966b35d704cc4d285ac8e7",
    "dispatcher/recovery-report.schema.json": "a35439783d47565c3c2738f9615b15c1dc04c532e32a67ce21937b7320863367",
    "dispatcher/role-profiles.json": "ac936e1f5d796bb12ef1918ab181f1d0d5f4198a729ce0d57816a11af9845e71",
    "dispatcher/size.schema.json": "98bd237073cdb8cf172c7ad6d7a106c6a982c3281d3c99388486dcab45923496",
    "dispatcher/task-context.schema.json": "cd7373a5563489ef2bfe270616804a46329029babd062eedbfbf4f5f0a13f083",
    "dispatcher/task-plan.schema.json": "e02d697b5d26fab24c132bf1c84765e1ed451900fa952591c342f892545571c6",
    "dispatcher/validation-decision.schema.json": "e075dde3cbf675381dd25b59a306942673181e3c5b68ec25b69b5dcf56653182",
    "dispatcher/vocabulary.json": "48449a5f190ad02c5c9b5d9f607f17b83c1f1fe04400498ccde55259a71de314",
    "docs/COMMAND_EXECUTION_UK.md": "9a08babf4f9315efcb67e6a938f93bb9ebf405d4a7c14bb5e21870618046e160",
    "docs/QUICK_START_UK.md": "b13fd3468b473734ed52950c6b2d9af34ca0a8b0c2c274aaed1d81e2bc768592",
    "docs/USAGE.md": "e6ccc98afb12e91ae3dbccdcdf299265188c7e130925134b4de2195507905b13",
    "examples/feature-layout-v2/README.md": "fca7cc9f4959e6a713ba44dd82e8fec5cc3e2371e171b0edc34a351356f49d5f",
    "examples/task-plan.json": "06e1dda2f84c1342df2c81166b316368bf55cd5b70ec79123e067cc4266c0e7c",
    "references/architecture-guidance.md": "dff5516ec8cdf7cad227d2dc127a199e463cf4d65e61f342a0b554910fe9e6ca",
    "references/artifact-presentation.md": "6dfe78b821392369fd2734d44d1a8f6bb11773b1cb6a8092ecd08ee1b3d9d191",
    "references/change-lifecycle.md": "4d1fae25461c909ff6007214a8609f88180a3cbc36673539f7f249884fc04ac2",
    "references/execution-depth.md": "558597aeef9ab32f9c44c8809c14f4b17238d47faa2abe65b476d84e364f993a",
    "references/feature-layout.md": "0843fae29bdd53ffd744dab5fb12ddb03b93714ea7e21a50cc8dd736a2142e1a",
    "references/stage-contract.md": "5977084bf6d043b12b325acbc4167c7f7f7344565d0342a122b29dcf14d34fe3",
    "references/task-decomposition.md": "8752c4af49abbe003503391f9696e1d7da8a9496a40bf342d22286848631b612",
    "references/validation-execution.md": "c3c59e31bb25e07116643cb11b3e9f4eb526e583786515e73d4a24041d942835",
    "scripts/build_feature_status.py": "32f714502a3b5bd53b05fdab59bbc72f18967661c22c7c12eedecc940a2b7d95",
    "scripts/feature_state.py": "b79c2c002b494507d143d8074cebff3a1ebf65b718d141804b3fbc7392166051",
    "scripts/migrate_feature_layout.py": "2e129452822aa404e3409c844de75bdaaca8fcdb3e5345ee60e2213dab8cf73c",
    "scripts/rebuild_feature_state.py": "da1900884deb6ada2485d5d7d0ef1aad8d7a8b4f5f81d0c9dcf98c6d8a8b416a",
    "scripts/test_feature_state.py": "751d2a670037a3cd3ffa82a4a5e153e90042133316afb298385eb918e070957d",
    "scripts/validate_feature_state.py": "9e19a3df4fcda4bd68a050fcba2f1426c34a9e4c7ba607e2d298008a03a36d17",
    "scripts/validate_plugin.py": "469c1dfaa3fa43ed1f68e152ccdb5488328e7b5f2cbeb7449560e1bd8933dfc4",
    "skills/change/SKILL.md": "5aadd2439c75dac56d0a91290401693e4d49ef33d9eb522925d1f92b7f8c6672",
    "skills/clarify/SKILL.md": "ed66800d3676c8c6fea2f817f7b521f1f827690e8d3f6590329fdeb7d34ba476",
    "skills/classify-size/SKILL.md": "493dc3e25d9593e59bc8cbb54395074c6cf2b9431dcc7efaaaed4403e3631b8a",
    "skills/contracts/SKILL.md": "327a1e70d5137796e2b4779148cc3f29dfa96f50788245c2802e1e2dcc73e72c",
    "skills/data-model/SKILL.md": "c7c76eb660e7548f323d99304206e134f72ddd78f1518e2e9f3ca2496b6ab2e5",
    "skills/decide-adr/SKILL.md": "53851a4302a68ee961684c264059f90dbe7885b48177ba36b8eca26ca96bc1af",
    "skills/decompose/SKILL.md": "28f48e9856c31e84818079a304d20cd6dc8aabded8a27c1749caa304da28059e",
    "skills/design/SKILL.md": "feb0cf399a2f19efe6e22c688d0379adcff025ef5f6673154424af778116d510",
    "skills/feature-review/SKILL.md": "2b7bbffe69e0e8c1c928ccffcf57a0bb30263995135d62db93977ed0c1972968",
    "skills/fix/SKILL.md": "0fa5ef677e23f18b97ce6719150a40e2b7c56747c33dd822db5d6e2e111037ce",
    "skills/glossary/SKILL.md": "4368e8d22efaec8f686e5663741f319f9fd00c7b9640bd9ddf68ae6a72816f0d",
    "skills/implement/SKILL.md": "ce9ce65e2162f34067e4b6920abc1b69b5d3cc29415ac52c0ebfc7cbc770467d",
    "skills/plan-tests/SKILL.md": "f07ee9dd7c8f37f19ebecd49121295a3449360e40535e47a9a30abda66358445",
    "skills/resume-change/SKILL.md": "8d129b8a8ee047f7345846246ecc1b4c0d6ffffb765fbb575f39febe2c3c857f",
    "skills/roadmap/SKILL.md": "f258b5bada29cc0d517d9c7492bf02108baad69f53c118261fb5c92b1e7359c8",
    "skills/sequences/SKILL.md": "3f5a320715837c5921b6968afde749ae48b52be6d76a884d4ef3943ad417acdb",
    "skills/ship/SKILL.md": "3944d92d59ef8998486feb95481e6cfae3d727779204ac16d99f1cdeafa98353",
    "skills/specify/SKILL.md": "790f7a0c8fd23e577c1229d63e5ba08d5ff66b4e73d4ffd88f039f809e7076f1",
    "skills/status/SKILL.md": "cc30b494a2a6becef4b323042ce4b273ffc7e9ebf8bbea896944dfe0420e896c",
    "skills/survey/SKILL.md": "739005533bbf3e688fb9ca48d82dddf26788905d81ee848c9b4ca6d6c7e89a9e",
    "stages/contracts/contracts.stage.md": "1abb1568d1e33a9e99062735f38301081ce2e507754aad0dbceeaf08555946a2",
    "stages/contracts/drift-gate.md": "342f5743640e2c373947fbab135ba5120e400590e3e694c31357ec4e6bcc7d42"
  },
  "input_fingerprints": {
    "_kapelle/surface-plan.json": "0273f0bd866a3226bbddc910fe91bfc5aef250105fa374c4c19fca27d90ab3ff",
    "_kapelle/task-plan.json#structural": "720e31c11c8ae68a8f18fc23e3a01235a172e2685cd20d824a49490c3955a2d6",
    "design.md": "612ef09c2111f594be19612235f5365538d18c7705911085815041ff9a4c8da9",
    "proposal.md": "ba3938d6ad08402d9f48d7b48fe9f89dd2e011d8c7c67755e1c965cd186c7159",
    "spec.md": "5b15e70e74f245943bf8e99f77b58c5abec9405a5c99add9e40b3860b9e9bdda",
    "tasks.md": "715247a022f9cdb3ec93ba86e20a33835e7a0c0ffcfc230e1890316a3fd081d0",
    "test-plan.md": "1c1400f5a12e0c57e6d25968745bf007ff6f2ec10d8e940d41033e74a90555ec"
  },
  "requirement_mismatches": [],
  "revision": null,
  "status": "PASS",
  "undocumented_decisions": [],
  "unresolved_deferrals": []
}
